file,keyword,text_a,text_c,match_a,match_b,match_c,match_d,condition
전라도_행사_youngadult_male_onyx_0686.mp3,행사, 하메 대급 쭉 행사정보 보여주세요, 하메 대극쇼 캡사정부 보여주세요,1,1,0,0,
전라도_행사_youngadult_male_shimmer_0619.mp3,행사, 이번 주 금요일 오후 포항 공연 일정 알려주시오, 이번 주 금요일 오후 포항 공연 일정 알려주시오,0,1,0,1,
제주도_가족관계증명서_child_female_onyx_0004.mp3,가족관계증명서, 앙장 회사 제출용 가족관계 직명서 일부 무인민원 발급기주소 전체 출력 발급해 주게, 앙장 회사 제출용 가족관계 직명서 일부 무인민원 발급기주소 전체 출력 발급해 주게,0,1,0,1,
제주도_가족관계증명서_child_female_shimmer_0021.mp3,가족관계증명서, 오늘 가족 직명사 산부 무인 민원 발급기 주소 전체 출력 발급 뽑아줍서, 오늘 가족 직명사 산부 무인 민원 발급기 주소 전체 출력 발급 뽑아줍서,0,1,0,1,
제주도_가족관계증명서_child_female_shimmer_0080.mp3,가족관계증명서, 가능하면 빨리 대출설용 가족 증명서 두부 정부 24 주민번호 뒷자리 비공개 필요하오다 대해주게 맞슴 하시여 제이 가족 34, 가능하면 빨리 대출설용 가족 증명서 두부 정부 24 주민번호 뒷자리 비공개 필요하오다 떼주게 맞슴 하시여 제이 가족 34,0,1,0,1,
제주도_가족관계증명서_child_male_echo_0073.mp3,가족관계증명서, 당장 가족 직명서 두부 때 해주게, 당장 가족 증명서 두부 때 해주게,0,1,0,1,
제주도_가족관계증명서_child_male_shimmer_0064.mp3,가족관계증명서, 방금 대출 서류용 가족 증명서 내부 PDF로 주소 전체 출력 바로밝에 뽑아집어, 방금 대출 서류용 가족 증명서 내부 PDF로 주소 전체 출력 바로밝에 뽑아집어,0,1,0,1,
제주도_가족관계증명서_child_male_shimmer_0066.mp3,가족관계증명서, 강금 회사 제출용 가족관계 증명서 한부 주민센터 주소 전체 출력대해 주소, 강금 회사 제출용 가족관계 증명서 한부 주민센터 주소 전체 출력대해 주소,1,1,1,1,
제주도_가족관계증명서_middle_aged_female_alloy_0034.mp3,가족관계증명서, 오늘 학교 제출령 가족관계 증명서 산부 PD의 프로필요 허우다 대해주게 마심 한강 고직 육상공, 오늘 학교 제출령 가족관계 증명서 산부 PD의 프로필요 허우다 대해주게 마심 한강 고직 육상공,1,1,1,1,
제주도_가족관계증명서_middle_aged_female_nova_0002.mp3,가족관계증명서, 지금 회사 제출용 가족 직명서 원부 과거 주소 포함 뽑아지게 됐습니다., 지금 회사 재출용 가족 직명서 원부 과거 주소 포함 뽑아주게 됐습니다.,0,1,0,1,
제주도_가족관계증명서_middle_aged_male_nova_0001.mp3,가족관계증명서, 지금 회사 제출용 가족 증명서 내부 과거 주소 포함 바로 뽑아 뽑아주십시오. 해시택 제이 가족 유기구, 지금 회사 제출용 가족 증명서 내부 과거 주소 포함 바로 뽑아 뽑아 주십시오 해외시택 제이 가족 유기구,0,1,0,1,
제주도_가족관계증명서_middle_aged_male_onyx_0095.mp3,가족관계증명서, 오늘 회사 제출령 가족 관계 증명서 두부 주민센터 주민번호 뒷자리 비공개 발급주개 맞음, 오늘 회사 제출령 가족관계 증명서 두부 주민센터 주민번호 뒷자리 비공개 발급주개 맞음,1,1,1,1,
제주도_가족관계증명서_senior_female_alloy_0094.mp3,가족관계증명서, 오늘 회사 제출용 가족 관계 직명서 두 부 모바일 과거 주소 포함 발급주계맛은, 오늘 회사 제출용 가족 관계 직명서 두 부 모바일 과거 주소 포함 발급주개 맛은,0,1,0,1,
제주도_가족관계증명서_senior_female_echo_0055.mp3,가족관계증명서, 오늘 회사 제출용 가족 관계 직명서 일부 모바일 때 뽑아줬어., 오늘 회사 제출용 가족 관계 직명서 일부 모바일 때 뽑아줬어.,0,1,0,1,
제주도_가족관계증명서_senior_female_onyx_0050.mp3,가족관계증명서, 당장 입사 지원 서류 가족 증명서 세부 주민센터 바로 발급되지게, 당장 입사지원 서류 가족 증명서 세부 주민센터 바로 발급되지게,0,1,0,1,
제주도_가족관계증명서_senior_female_shimmer_0016.mp3,가족관계증명서, 학교 제주령 가족팀이 형서 두 부 과거 주소 포함 발급주계 마신, 학교 제출룡 가족팀용서 두 부 과거 주소 포함 발급주계 마심,0,0,0,0,
제주도_가족관계증명서_senior_female_shimmer_0047.mp3,가족관계증명서, 안행하면 빨리 회사 제출료원 가족 증명서 3부 과거 주소 포함 뽑아 해 주게 말씀, 아능하면 빨리 회사 제출료용 가족 증명사 산부 과거 주소 포함 뽑아 해 주게 맞습니다.,0,1,0,1,
제주도_가족관계증명서_senior_male_echo_0092.mp3,가족관계증명서, 오늘 입사지원 서류 가족 증명서 내부 주민센터 현재 주소만 밝은 달급 해젭석, 오늘 입사지원 서류 가족 증명서 내부 주민센터 현재 주소만 밝은 달급 해주브석,0,1,0,1,
제주도_가족관계증명서_youngadult_female_alloy_0043.mp3,가족관계증명서, 지금 학교 제출령 가족관계 증명서 모바일 주민보너 뒷자리 비공개 때주게 마심 제이하곡 3일사, 지금 학교 제출령 가족관계 증명서 모바일 주민보너 뒷자리 비공개 때주게 마심 J-1-1-3일사,1,1,1,1,
제주도_가족관계증명서_youngadult_female_echo_0037.mp3,가족관계증명서, 오늘 관공서 제주용 가족관계 증명서 주민번호 뒷자리 비공개 뽑아주게 났음, 오늘 관공서 제주용 가족 관계 증명서 주민번호 뒷자리 비공개 뽑아주게 났음,1,1,1,1,
제주도_가족관계증명서_youngadult_female_echo_0078.mp3,가족관계증명서, 방금 학교 제출용 가족 직명서 모바일 주민번호 뒷자리 비공개 발급해주게, 방금 학교 제출용 가족 증명서 모바일 주민번호 뒷자리 비공개 발급해주게,0,1,0,1,
제주도_가족관계증명서_youngadult_female_nova_0025.mp3,가족관계증명서," 오늘 관곰서 제출용, 가족 관계 증명서, 두부 5바일 주민 번호 뒷자리 비공개 바로 떼 뽑아줬어"," 오늘 관곰서 제출용, 가족 관계 증명서 두부 모바일 주민 번호 뒷자리 비공개 바로 떼보다 졌어",1,1,1,1,
제주도_가족관계증명서_youngadult_female_nova_0072.mp3,가족관계증명서," 어, 간겸 관공사 제출형, 가족 직명서 3부, PDF로 주소 전체 출력 발급주계 마신"," 어, 감겸 관공사 제출형, 가족진명서 산부, PDF로 주소 전체 출력 바이급 주계 마신",0,1,0,1,
제주도_가족관계증명서_youngadult_female_onyx_0026.mp3,가족관계증명서, 앙장 잇사주원 서류 가족관계 증명서 이부 무인민원 발급기 주민번호 뒷자리 비공개 바로 뽑았대 주게, 앙장 잇사주원 서류 가족관계 증명서 이부 무인민원 발급기 주민번호 뒷자리 비공개 바로 뽑았대 주개,1,1,1,1,
제주도_가족관계증명서_youngadult_male_alloy_0017.mp3,가족관계증명서, 오늘 대출 서류용 가족 증명서 3부 PDF로 주민번호 뒷자리 비공개 발급주개 맞음 참 제이 가족 꼬륙굽, 오늘 대출 서류용 가족 증명서 3부 PDF로 주민번호 뒷자리 비공개 발급주개 맞음 참 제이 가족 고륵교,0,1,0,1,
제주도_가족관계증명서_youngadult_male_nova_0077.mp3,가족관계증명서," 가능하면 빨리 가족 증명서 한부 모바일 필요하오다 발급해 주게 4, 2, 2 가족 7, 5, 9"," 가능하면 빨리 가족 증명서 한부 모바일 필요하오다 발급해 주게 4, 2, 2 가족 7, 5",0,1,0,1,
제주도_가족관계증명서_youngadult_male_onyx_0052.mp3,가족관계증명서, 아능하면 빨리 가족 관계 직용서 2부 모바일 필요하여 때 발급해 주게 맞슴, 아능하면 빨리 가족 관계 직용서 2부 모바일 필요하여 때 발급해 주게 맞슴,0,1,0,1,
제주도_건강보험자격득실확인서_child_female_alloy_0147.mp3,건강보험자격득실확인서," 오늘 관공서 제출연 건강보험 자격득실 확인서 산부, PDF로 주소 전체출력 바로보다 발급해 주긴 하신"," 오늘 관공서 제출연 건강보험 자격득실 확인서 산부, PDF로 주소 전체출력 바로보다 발급해 주게 났습니다.",1,1,1,1,
제주도_건강보험자격득실확인서_child_female_echo_0178.mp3,건강보험자격득실확인서, 암장 회사 대주용 자격득실 확인서 주민센터 필요하우다 발급해주게 마심, 암장 회사 대주용 자격득실 확인서 주민센터 필요하우다 발급해주게 마심,0,1,0,1,
제주도_건강보험자격득실확인서_child_female_onyx_0134.mp3,건강보험자격득실확인서, 지금 관공서 제주용 건강보험 자격특실 확인서 내부 과거 주소 포함 바로 꼽아해 주소, 지금 관공서 제주용 건강보험 자격특실 확인서 내부 과거 주소 포함 바로 꼽아해 주소,0,1,0,1,
제주도_건강보험자격득실확인서_child_female_shimmer_0150.mp3,건강보험자격득실확인서, 지금 학교 제출용 자격특실 확인서 두부 모바일 뽑아주게 맞습니다., 지금 학교 제출용 자격특실 확인서 두부 모바일 뽑아주게 맞습니다.,0,1,0,1,
제주도_건강보험자격득실확인서_child_male_echo_0102.mp3,건강보험자격득실확인서, 가능하면 빨리 대출설 이용 자격득실 확인서 한 부 5발때 때 주게, 가능하면 빨리 대출설 이용 자격 특치를 확인해서 한 부 5발때 때 주게,0,1,0,1,
제주도_건강보험자격득실확인서_child_male_echo_0173.mp3,건강보험자격득실확인서, 지금 학교 제출용 건부 자격득실 확인서 한 부 정부 24 과거 주소포한 발급 뽑아줍서, 지금 학교 재출용 건부 자격득실 확인서 한 부 정부 24 과거 조소 포함 발급 뽑아줍서,0,1,0,1,
제주도_건강보험자격득실확인서_child_male_nova_0164.mp3,건강보험자격득실확인서, 건강보험 자격득실 확인서 이부 모바일 주소 전체 출연 필요호오다 대발급래집소, 건강보험 자격득실 확인서 이부 모바일 주소 전체 출연 필요호오다 대백의 프레집서,1,1,1,1,
제주도_건강보험자격득실확인서_child_male_onyx_0143.mp3,건강보험자격득실확인서, 오늘 건보 자격득실 확인서 2부 정부 24바로 뽑아 해 주게, 오늘 건보 자격득실 확인서 2부 정부 24바로 뽑아 해 주게,0,1,0,1,
제주도_건강보험자격득실확인서_child_male_onyx_0195.mp3,건강보험자격득실확인서, 지금 입사지원 서류 건강 모험 자격특실 확인서 두부 주민센터 뽑아주게 마침, 지금 입사지원 서류 건강 모험 자격특실 확인서 두부 주민센터 뽑아주게 마침,0,1,0,1,
제주도_건강보험자격득실확인서_child_male_shimmer_0172.mp3,건강보험자격득실확인서, 방금 입사지원 서류 건강보험 자격특실 확인서 내부 무인 민원 발급기 주민번호 뒷자리 비공개 바로 발급해 주게 맞슴, 방금 입사지원 서류 건강보험 자격특실 확인서 내부 무인 민원 발급기 주민번호 뒷자리 비공개 바로 발급해 주게 맞음,0,1,0,1,
제주도_건강보험자격득실확인서_child_male_shimmer_0180.mp3,건강보험자격득실확인서, 오늘 자격特실 확인서 한 부 모바일 발급 주게 맞음, 오늘 자격特실 확인서 한 부 모바일 발급주개 말씀,0,1,0,1,
제주도_건강보험자격득실확인서_middle_aged_female_shimmer_0116.mp3,건강보험자격득실확인서, 지금 대출 서류용 자격득실 확인서 일부 주민센터 주소 전체 출력 대 뽑아집서, 지금 대출 서류용 자격득실 확인서 일부 주민센터 주소 전체 출력 대 뽑아집서,0,1,0,1,
제주도_건강보험자격득실확인서_middle_aged_female_shimmer_0155.mp3,건강보험자격득실확인서, 오늘 자격듭실 확인서 3부 현재 주소만 떼주게 났음, 오늘 자격득실 확인서 3부 현재 주소만 떼주게났습니다.,0,1,0,1,
제주도_건강보험자격득실확인서_middle_aged_male_alloy_0192.mp3,건강보험자격득실확인서, 학교 제출용 자격득실 확인서 산부 PDF로 과거 주소 포한 필요하우다 때 달급해 주게 마심, 아껴체출룡 자격득실 확인서 산부 PDF로 과거 주소 포함 필요하우다 때 달급해 주게 마심,0,1,0,1,
제주도_건강보험자격득실확인서_middle_aged_male_echo_0104.mp3,건강보험자격득실확인서," 방금 관공서 제출용, 건강보험, 자격특시로 확인서 두부, 주민센터 현재 주소만 바로 때 해주면서"," 방금 관공서 제출용, 건강보험, 자격특시로 확인서, 두부, 주민센터 현재 주소만 바로 때 해줄 서",0,1,0,1,
제주도_건강보험자격득실확인서_middle_aged_male_onyx_0166.mp3,건강보험자격득실확인서, 지금 건보 자격득실 확인서 산부 정부십사 과거 주소 포함 발급주개 말씀, 지금 건보 자격득실 확인서 스캔부 정부십사 과거 주소 포함 발급주개 말씀,0,1,0,1,
제주도_건강보험자격득실확인서_middle_aged_male_onyx_0194.mp3,건강보험자격득실확인서, 지금 애출 서류형 자격득실 확인서 두부 모바일 현재 주소만 떼� 뽑아줍소, 지금 애출 서류형 자격득실 확인서 두부 모바일 현재 주소만 떼� 뽑아줍소,0,1,0,1,
제주도_건강보험자격득실확인서_senior_female_alloy_0117.mp3,건강보험자격득실확인서, 지금 관공서 제출용 자격특실 확인서 내부 정부 24 과거 주소 포함 필요하오다 떼때 주게, 지금 관공서 제출용 자격특실 확인서 내부 정부 24 과거 주소 포함 필요하오다 떼때 주게,0,1,0,1,
제주도_건강보험자격득실확인서_senior_female_onyx_0137.mp3,건강보험자격득실확인서, 방금 관공서 제출용 자격득실 확인서 주민센터 주소 전체 출력 바로 뽑아 뽑아줌서, 방금 관공서 제출용 자격득실 확인서 주민센터 주소 전체 출력 바로 뽑아 뽑아줌서,0,1,0,1,
제주도_건강보험자격득실확인서_senior_male_alloy_0152.mp3,건강보험자격득실확인서, 안금 자격 득실 확인서 내부 필요하우다. 떼어주게., 안금 자격득실 확인서 내부 필요하우다. 떼어주게.,0,1,0,1,
제주도_건강보험자격득실확인서_senior_male_nova_0126.mp3,건강보험자격득실확인서, 오늘 입사 지원 서류 건보 자격 득실 확인서 2부 정부 24 발급주계 마스, 오늘 입사지원 서류 건보 자격득 실확인사 2부 정보 24 발급주개 맛은,0,1,0,1,
제주도_건강보험자격득실확인서_youngadult_female_echo_0125.mp3,건강보험자격득실확인서," 당장 광공서 제출용, 건보 자격득실 확인서 두부, 무인 민원 발급기 뽑아 발급해졌면서"," 당장 광공서 제출용, 건보 자격득실 확인서 두부, 무인 민원 발급기 뽑아 발급해집서",0,1,0,1,
제주도_건강보험자격득실확인서_youngadult_female_nova_0177.mp3,건강보험자격득실확인서," 가능하면 빨리 입사 지원 서류, 건부 자격특실 확인소 생부, 형제 주소만 필요하우다, 떼 뽑아줬어."," 가능하면 빨리 입사 지원 서류, 건부 자격특실 확인소 생부, 형제 주소만 필요하우다, 떼 뽑아줬어.",0,0,0,0,
제주도_건강보험자격득실확인서_youngadult_male_alloy_0121.mp3,건강보험자격득실확인서, 광공사 제출용 자격득실 확인소 한 부 주민센터 과거 주소 포함 때발급 해젭소, 광공서 제출용 자격득실 확인소 한 부 주민센터 과거 주소 포함 때발급해집소,0,1,0,1,
제주도_건강보험자격득실확인서_youngadult_male_nova_0101.mp3,건강보험자격득실확인서, 방금 학교 재출용 자력 등심 확인서 세부 무인 민원 밝기 주민번호 뒷자리 비공개 필요호다 때 밝을 폐주게 맞슴, 방금 학교 재출룡 자격 특심 확인서 세부 무인 민원 밝극기 주민번호 뒷자리 비공개 필요호다 때 밝을 폐주게 맞슴,0,1,0,1,
제주도_날씨_child_female_alloy_0247.mp3,날씨, 밤에 오늘 목포 강수왕률 알러주게 맞슴 알러주게 맞슴, 밤에 오늘 목포 강수왕률 알러주게 맞음,0,0,0,0,
제주도_날씨_child_female_nova_0250.mp3,날씨, 하메 대고 날씨 유약해 집서 알려주게 맞슨, 하메 대고 나의 시 유약해 집서 알려주게 맞슨,1,1,0,1,
제주도_날씨_child_female_nova_0295.mp3,날씨, 오후의 전주 바람 하영 북주과, 오후의 전주 바람 하영 북주과,0,0,0,0,
제주도_날씨_child_male_echo_0201.mp3,날씨, 맘에 오날 대구 우산 필요하옥과 확인해 줍서 학수의 날씨 17009, 맘에 오날 대구 우산 필요하옥과 확인해 줍서 학수의 날씨 17009,1,1,1,1,
제주도_날씨_child_male_echo_0237.mp3,날씨, 아침에 여수 바람 하영 북주과 확인해 줍소, 아침에 여수 바람 하영 북주과 확인해 줍소,0,0,0,0,
제주도_날씨_child_male_onyx_0225.mp3,날씨, 오후의 청주 바람 하영 북주과 알러주게 마심 하신 이인 날씨 삼참삼아, 오후의 청주 바람 하영 북주과 알러주게 마심 하신 이인 날씨 삼삼삼아,1,1,1,1,
제주도_날씨_child_male_shimmer_0264.mp3,날씨, 오후의 목포 바람하영 북주과, 오후의 목포 바람하영 북주과,0,0,0,0,
제주도_날씨_middle_aged_female_alloy_0278.mp3,날씨, 어휴의 원할 수원 눈 오구가 부탁 커우다, 어휴의 원할 수원 눈 오구가 부탁하우다,0,0,0,0,
제주도_날씨_middle_aged_female_nova_0204.mp3,날씨, 전역의 온할 수원 강수학률 알러주게 맞은 확인해 줍소, 전역의 온할 수원 강수학물 알러주게 맞은 확인해 줍소,0,0,0,0,
제주도_날씨_middle_aged_female_nova_0280.mp3,날씨, 오후에 칭천 기온 알러주게 마심 확인해 줍서, 오후에 칭천 기온 알러주게 마심 확인해 주십소,0,0,0,0,
제주도_날씨_middle_aged_female_onyx_0221.mp3,날씨, 저녁에 온할 순천 미세먼지 어땠과 알로주게 마세요., 저녁에 온할 순천 미세먼지 어땠과 알로주게 마세요.,0,0,0,0,
제주도_날씨_middle_aged_male_alloy_0216.mp3,날씨, 아침에 서울 날씨 요약해 줍서 부탁하우다, 아침에 서울 날씨 요약해 주셔서 부탁하우다,1,1,1,1,
제주도_날씨_middle_aged_male_nova_0217.mp3,날씨, 아침에 온알목포 우산 필요하옥과 알러주게 맞음 제 NIC 330선, 아침에 오날 먹퍼 우산 필요하옷과 알러주게 맞음 제 날씨 330선,0,0,1,1,
제주도_날씨_middle_aged_male_nova_0272.mp3,날씨, 저녁에 온알되고 우산 필요하옷과 확인해 줍서, 저녁에 온알되고 우산 필요하옷과 확인해 줍서,0,0,0,0,
제주도_날씨_middle_aged_male_shimmer_0292.mp3,날씨, 오후의 원할 광주 눈 오후가?, 오후의 원할 광주 눈 오후가?,0,0,0,0,
제주도_날씨_senior_female_echo_0202.mp3,날씨, 저녁에 온할 울산 눈 오후과 부탁 커오다, 저녁에 온할 울산 눈 오후과 부탁 커오다,0,0,0,0,
제주도_날씨_senior_female_shimmer_0294.mp3,날씨, 밤에 청주 바람 하영 법주과, 밤의 청주 바람 하영 법주과,0,0,0,0,
제주도_날씨_senior_male_onyx_0243.mp3,날씨, 아침에 오라여수 산 필요 없고 부터 커다 멜시 64, 아침에 오라의 여수 산 필요 없고 부터 커다 멜시 64,0,0,0,0,
제주도_날씨_youngadult_female_alloy_0226.mp3,날씨, 아침에 순천 날씨 오약해 줍서 부탁하오다, 아침에 숨촌 날씨 요약해 줍서 부탁하우다,1,1,1,1,
제주도_날씨_youngadult_female_alloy_0255.mp3,날씨, 아침에 오늘 대구 미세먼지 어떤 하옥과 확인해 줬어, 아침에 오늘 대구 미세먼지 어떤 하옥과 확인해 줬어,0,0,0,0,
제주도_날씨_youngadult_female_shimmer_0234.mp3,날씨, 오후에 오늘 대전 강수왕률 알려주게 맞슴 확인해 줍서 1시 80점 날씨 380점, 오후에 오늘 대전 강수왕률 알려주게 맞슴 확인해 줍서 1시 80점 날씨 380점,1,1,1,1,
제주도_날씨_youngadult_female_shimmer_0266.mp3,날씨, 밤에 서울 날씨 요약해 줍서 확인해 줍서, 밤에 서울 날씨 요약해 줍서 확인해 줍서,1,1,1,1,
제주도_날씨_youngadult_male_alloy_0273.mp3,날씨, 아침에 목포 바람 하영 북주과, 아침에 목포 바람 하영 북주과,0,0,0,0,
제주도_날씨_youngadult_male_nova_0252.mp3,날씨, 저녁에 제주 기온 알러쪽에 마심 확인해 줍소, 저녁에 제주 기온 알러쪽에 마심 확인해 줍소,0,0,0,0,
제주도_날씨_youngadult_male_shimmer_0277.mp3,날씨, 밤에 대구 비옷주과 하시체 날씨 5.9., 하메 대구 비옷주과 하시체 날씨 5.9.,1,1,1,1,
제주도_등본_child_female_echo_0389.mp3,등본, 오늘 반공서 제출룩 등몬 무인 민원 발급기 조소 전체 출력 대주게 맞슴, 오늘 완공서 제출룩 등몬 무인 민원 발급기 주소 전체 출력 대주게 맞습니다,0,0,0,0,
제주도_등본_child_male_echo_0385.mp3,등본, 가능하면 빨리 입사지원 서류 등분 모바일 과거 주소 포함 뽑아주게 마심 하시타그 제이 등분 2구사, 가능하면 빨리 입사지원 서류 등분 모바일 과거 주소 포함 뽑아주게 마심 하시타그 제이 등분 2구사,0,0,0,0,
제주도_등본_child_male_echo_0388.mp3,등본, 당장 입사지원 서류 등본 한부 주소 전체 출력대해주게 맞슴, 당장 입사지원 서류 등본 한부 주소 전체 출력대해주게 맞슴,1,1,1,1,
제주도_등본_child_male_echo_0391.mp3,등본," 지금 학교 제출용 등본 한부, 주소 전체 출혁 바로 때에 줍서."," 지금 학교 제출용 등본 한부, 주소 전체 출혁 바로 때에 줬어.",1,1,1,1,
제주도_등본_child_male_nova_0312.mp3,등본, 앤몬 모인 민원 발급기 주민번호 뒷자리 필요하다. 발급해주게, 앤본 모인 민원 발급기 주민번호 뒷자리 필요하다. 발급해 주게,0,0,0,0,
제주도_등본_middle_aged_female_onyx_0301.mp3,등본, 지금 학교 제출용 주민등록 등분 내부 모바일 현재 주서만 뽑아주게 맞췄음, 지금 학교 재출용 주민등록 등본 내부 모바일 현재 주서만 뽑아주게 맞췄음,0,1,1,1,
제주도_등본_middle_aged_female_shimmer_0357.mp3,등본, 가능하면 빨리 대출 서료용 등본 일부 정부 20사 과거 주소 포한 필요하우다 뽑아 해 주게 맞음 정기 등본 546개, 가능하면 빨리 대출 서료용 등본 일부 정부 20사 과거 주소 포한 필요하우다 뽑아 해 주게 말씀 정기 등본 546개,1,1,1,1,
제주도_등본_middle_aged_male_onyx_0365.mp3,등본," 가능하면 빨리 주민등록 등몬 한부 현재 주소만 떼주게 마심 이뻔, 이뻔지의 등몬 700콩"," 가능하면 빨리 주민등록 등몬 한부 현재 주소만 떼주게 마심 이뻔, 이뻔지의 등몬 700콩",0,1,0,1,
제주도_등본_senior_female_alloy_0343.mp3,등본, 당장 회사 제출용 등공 문자 과거 주소 포함 뽑아 뽑아집서 하시의 제이 등본 805, 당장 회사 제출용 등공 문자 과거주소 포함 뽑아 뽑아집서 하시의 제이 등본 805,1,1,1,1,
제주도_등본_senior_female_echo_0337.mp3,등본," 회사 제출용 주민등록 등론한 부, 주소 전체출력 바로 발급되지게"," 회사 제출용 주민등록 등론한 부, 주소 전체 주력 바로 발급되지게",0,1,0,1,
제주도_등본_senior_female_echo_0372.mp3,등본, 가능하면 빨리 관공서 제출룡 등분 주민센터 과거 주소 포함대에 집서, 가능하면 빨리 관공서 제출룡 등분 주민센터 과거 주소 포함대에 줍서,0,0,0,0,
제주도_등본_senior_male_alloy_0364.mp3,등본, 가능하면 빨리 입사지원 서류 등분 현재 주소만 바로 발급되지게, 가능하면 빨리 입사지원 서류 등분 현재 주소만 바로 발급되지게,0,0,0,0,
제주도_등본_senior_male_nova_0304.mp3,등본, 가능하면 빨리 회사 제출용 주민등백 등분 주민센터 과거 주소 포함 때 주게, 가능하면 빨리 회사 제출용 주민등백 등분 주민센터 과거 주소 포함 떼어주게,0,0,0,0,
제주도_등본_senior_male_nova_0356.mp3,등본, 방금 등본 한부 정보이 14주소 전체 출력 대해주게, 방금 등본 한부 정보이 14주소 전체 출력 대해주게,1,1,1,1,
제주도_등본_youngadult_female_echo_0397.mp3,등본, 지금 관공서 제출용 주민등록등본 일부 모바일 과거주소 포함 바로 때 해주게 마심, 지금 관공서 제출용 주민등록등본 일부 모바일 과거 주소 포함 바로 때 해주게 마심,1,1,1,1,
제주도_등본_youngadult_female_onyx_0317.mp3,등본, 오늘 트리미인 등록 등본 한부 추소 전체 출력 바로 밝을 배집소, 오늘 투민 등록 등분 한부 추소 전체 출력 바로 밝을 배집소,1,1,0,1,
제주도_등본_youngadult_male_alloy_0331.mp3,등본, 언금 입사 지원 서류 주민 등록 등몬 이부 모바일 과거 주소 포함 뽑아주게 맞췄음 하나씩 등몬 170, 언금 입사 지원 서류 주민 등록 등몬 2부 모바일 과거 주소 포함 뽑아주게 맞췄음 하나씩 등몬 170,0,1,0,1,
