file,keyword,text_a,text_c,match_a,match_b,match_c,match_d,condition
경상도_행사_middle_aged_female_shimmer_0607.mp3,행사, 아침에 광주 행사일을 정확인 알라 가이 알려주소, 아침에 광주 행사일을 정확인 알라 카이 알려주소,1,0,1,0,
경상도_행사_middle_aged_male_alloy_0690.mp3,행사, 이번 주 금요일 밤 대전 공연 일정 알려주셔서 보이소, 이번 주 금요일 밤 대전 공연 일정 알려주셔서 보이소,0,1,0,1,
경상도_행사_middle_aged_male_nova_0638.mp3,행사, 전역에 부산 행사 일정 확인할락 가위 확인할락 가위, 전역에 부산 행사 일정 확인할락 가위 확인할락 가위,1,1,1,1,
경상도_행사_middle_aged_male_shimmer_0627.mp3,행사, 오후에 광주 동네 행사정보 보여주이소 보이소, 오후의 광주 동네 행사정보 보여주이소 보이소,1,0,1,0,
경상도_행사_middle_aged_male_shimmer_0676.mp3,행사, 내일 아침 전주 풀리마켓 합니 거 보이소, 내일 아침 전주 풀리마켓 합니 거 보이소,0,0,0,0,
경상도_행사_senior_female_echo_0603.mp3,행사, 내일 오후 전주 공연 일정 알려주기소, 내일 오후 전주 공연 일정 알려주이소,0,1,0,1,
경상도_행사_senior_female_onyx_0668.mp3,행사, 아메 가족이랑 갈만한 광주 행사 추천해 주소 알려주이소, 아메 가족이랑 갈만한 광주 행사 추천해 주소 알려주이소,1,1,1,1,
경상도_행사_senior_male_alloy_0609.mp3,행사, 저녁에 대구 이번 주 축제 보고, 저녁에 대구 이번 주 축제 보고,0,0,0,0,
경상도_행사_senior_male_alloy_0635.mp3,행사, 오후의 가족이랑 갈만한 대구 행사 추천해 주소 부탁합니다., 5회 가족이랑 갈만한 대구 행사 추천해 주소 부탁합니다.,1,1,1,1,
경상도_행사_senior_male_nova_0620.mp3,행사," 모레 아침, 춘천공연 일정 알려지기소 확인할 라카이"," 모레 아침, 춘천공연 일정 알려주기소 확인하러 가위",0,1,0,1,
경상도_행사_senior_male_onyx_0684.mp3,행사, 이번 주 금요일 밤 순천 공연 일정 알려주기소, 이번 주 금요일 밤 순천 공연 일정 알려주기소,0,1,0,1,
경상도_행사_youngadult_female_shimmer_0614.mp3,행사," 5월 무료 행사 있습니까, 여수? 보이서?"," 5회 무료 행사 있습니까, 여수? 보이서?",1,1,1,1,
경상도_행사_youngadult_male_echo_0623.mp3,행사, 오늘 오후 부산 플리마트 탑니까 부탁합니다., 오늘 오후 부산 플리마켓 합니까 부탁합니다.,0,0,0,0,
경상도_행사_youngadult_male_onyx_0699.mp3,행사, 이번 주말 아침 세종 행사 뭐있노?, 이번 주말 아침 세종 행사 뭐있노?,1,1,1,1,
전라도_가족관계증명서_child_female_echo_0086.mp3,가족관계증명서," 안금 그러면 관공서 제출용, 가족 관계 증명서, 내부 과거 주소 포함보바 좀 해줄라인"," 안금 그러면 관공서 제출용, 가족 관계 증명서, 내부 과거 주소 포함보바 좀 해줄라잉",1,1,1,1,
전라도_가족관계증명서_child_female_nova_0082.mp3,가족관계증명서, 당장 아이고 가족 등명서 산부 모바일 주민번호 뒷자리 비공개 출력 좀 해주소, 당장 아이고 가족 등명서 산부 모바일 주민번호 뒷자리 비공개 출력 좀 해주소,0,1,0,1,
전라도_가족관계증명서_child_female_shimmer_0013.mp3,가족관계증명서, 가능하면 빨리 가족 직명서 두부 PDF로 과거 주소 포함 출력해 줄 아잉, 가능하면 빨리 가족 직명서 두부 PDF로 과거 주소 포함 출력해 줄 아잉?,0,1,0,1,
전라도_가족관계증명서_child_male_alloy_0098.mp3,가족관계증명서, 앵관공사 제출형 가족 증명사 한 부 무인민원 발급기 거거주소 포함보바 해부러 이 제 가족 일 30, 인 관공사 제출형 가족 증명사 한부 무인민원 발급기 거거주소 포함보바 해보러 이 제 가족 일 30,0,1,0,1,
전라도_가족관계증명서_child_male_onyx_0069.mp3,가족관계증명서, 안금 그라면 대출 서류용 가족 관계 직명서 두부 모바일 주민번호 뒷자리 비공개 때협로인 해씨제 가족 가족 457, 안금 그라면 대출 서류용 가족 관계 직명서 두부 모바일 주민번호 뒷자리 비공개 때협로인 해씨제 가족 가족 457,0,1,0,1,
전라도_가족관계증명서_child_male_shimmer_0046.mp3,가족관계증명서, 방금 그라면 광공서제 출용 가족 증명서 세부 발급 좀 해주시오, 방금 그라면 광공서세 출용 가족 증명서 세부 발급 좀 해주시오,0,1,0,1,
전라도_가족관계증명서_middle_aged_female_echo_0015.mp3,가족관계증명서, 바로 관공서 제출용 가족관계 직명서 한부 모바일 주소 전체 출력대해 주소, 바로 관공서 제출용 가족관계 직명서 한 보 모바일 주소 전체 출력대해 주소,0,1,0,1,
전라도_가족관계증명서_middle_aged_female_echo_0036.mp3,가족관계증명서," 방금 바로 회사 제출용, 가족 직명서 이부 모바일 현재 주소만 바로 발급해보란게 사실 가족 하십사"," 방금 바로 회사 제출용, 가족 직명서 2부 모바일 현재 주소만 바로 발급해보란께 하시 가족 하십사",0,1,0,1,
전라도_가족관계증명서_middle_aged_male_alloy_0057.mp3,가족관계증명서, 지금 학교 제출용 가족관계 직명서 한 부 주민번호 뒷자리 비공개 발급 좀 해주세요, 지금 학교 제출용 가족관계 직명서 한 부 주민번호 뒷자리 비공개 발급 좀 해주세요,0,1,0,1,
전라도_가족관계증명서_middle_aged_male_shimmer_0022.mp3,가족관계증명서, 지금인 대출 서류형 가족 직명서 3부 주민센터 주소 전체 출력 대별화인, 지금인 대출 서류형 가족 직명서 산부 주민센터 주소 전체 출력 대별어인,0,1,0,1,
전라도_가족관계증명서_senior_female_shimmer_0031.mp3,가족관계증명서, 안경 아이고 광공서 제출용 가족 관계 증명서 내부 정부 24주소 전체 출력 뽑아 혐표러임?, 안경 아이고 광공서 제출용 가족 관계 증명서 내부 정부 24주소 전체 출력 뽑아 혐표러임?,1,1,1,1,
전라도_가족관계증명서_youngadult_female_nova_0070.mp3,가족관계증명서, 오늘 회사 제출용 가족관계 증명사 산부 모바일 주민 번호 뒷자리 비공개 출력해 주셔야인?, 오늘 회사 제출용 가족관계 증명사 산부 모바일 주민 번호 뒷자리 비공개 출력해 주셔야인?,0,1,0,1,
전라도_가족관계증명서_youngadult_female_nova_0071.mp3,가족관계증명서, 가능하면 빨리 바로 가족 증명서 내부 정보 24바로 발급해버려요., 가능하면 빨리 바로 가족 증명서 내부 정보 24 바로 발급해버려요.,0,1,0,1,
전라도_가족관계증명서_youngadult_male_alloy_0019.mp3,가족관계증명서, 방금 그러면 광공사 제출용 가족 관계 증명서 내부 정부 24주 민번호 뒷자리 비공개 바로 떼어버려요., 방금 그러면 광공서 제출용 가족 관계 증명서 내부 정부 24 주민번호 뒷자리 비공개 바로 떼어버려요.,1,1,1,1,
전라도_가족관계증명서_youngadult_male_echo_0039.mp3,가족관계증명서, 지금 그러면 회사 제출료는 가족관계 직량서 두부 모바일 과거 주소 포함 바이그 펴브라잉, 지금 그러면 회사 제출료는 가족관계 직량서 두부 모바일 과거 주소 포함 바이그 펴브라잉,0,1,0,1,
전라도_건강보험자격득실확인서_child_female_shimmer_0136.mp3,건강보험자격득실확인서, 지금 그라면 입사지원 서류 건보 자격得시를 확인서 한 부 모바일 주민번호 뒷자리 비공개 바로 발급해주세요., 지금 그라면 입사지원 서류 건보 자격得시를 확인서 한 부 모바일 주민번호 뒷자리 비공개 바로 발급해주세요.,0,1,0,1,
전라도_건강보험자격득실확인서_child_male_echo_0182.mp3,건강보험자격득실확인서," 그라마는 대출 서령 건부, 자격특실 확인사한 부, PDF로 뽑아야 보라인?"," 그라마는 대출 서령 건부, 자격특실 확인사한 부, PDF로 뽑아야 보라인?",0,0,0,0,
전라도_건강보험자격득실확인서_child_male_nova_0157.mp3,건강보험자격득실확인서, 방금 그라면 건강보험 자격득실 확인서 일부 무인 민원 발급기 과거 주소 포함 바로 때 주소, 방금 그라면 건강보험 자격득실 확인서 일부 무인민원 발급기 과거 주소 포함 바로 때 주소,1,1,1,1,
전라도_건강보험자격득실확인서_child_male_onyx_0139.mp3,건강보험자격득실확인서, 방금 아이고 학교 제출용 자격득실 확인서 주민센터 현재 주소만 발급해보란께, 방금 아이고 학교 제출용 자격득실 확인서 주민센터 현재 주소만 발급해보란께,0,1,0,1,
전라도_건강보험자격득실확인서_child_male_onyx_0186.mp3,건강보험자격득실확인서, 가능하면 빨리 회사 제출룡 자격득실 확인서 2부 정부 24주민 번호 뒷자리 비공개 발급 좀 해주서, 가능하면 빨리 회사 제출령 자격득실 확인서 2부 정부 24주민 번호 뒷자리 비공개 발급 좀 해주서,0,1,0,1,
전라도_건강보험자격득실확인서_child_male_shimmer_0170.mp3,건강보험자격득실확인서," 가능하면 빨리 잉, 입사 지원서유 건보 자격득실 확인서, 내 두 무인 민원 밝급기 과거주소 포함 밝급 협으로행."," 가능하면 빨리 잉, 입사 지원서유 건보 자격득실 확인서 내 두 무인 민원 밝급기 과거주소 포함 밝급 협으로 잉",0,1,0,1,
전라도_건강보험자격득실확인서_middle_aged_female_alloy_0113.mp3,건강보험자격득실확인서, 방금 바로 학교 제출용 자격득실 확인서 한부 모인 민원 발급기 주민 번호 뒷자리 비공개 출력해 줄 아잉, 방금 바로 학교 제출용 자격득실 확인서 한부 모인 민원 발급기 주민 번호 뒷자리 비공개 출력해 줄 아잉,0,1,0,1,
전라도_건강보험자격득실확인서_middle_aged_female_shimmer_0115.mp3,건강보험자격득실확인서," 가능하면 빨리 그라면 입사 지원 서류, 건강보험 자격득실 확인서 정부 24주소 전체 출력 출력 협러인"," 가능하면 빨리 그라면 입사 지원 서류, 건강보험 자격득실 확인서 정부 24주소 전체 출력 출력 협러잉.",1,1,1,1,
전라도_건강보험자격득실확인서_middle_aged_male_alloy_0119.mp3,건강보험자격득실확인서, 지금 바로 회사 제출용 건보 자격특실 확인서 2부 주민센터 주민 번호 뒷자리 비공개 때 해주셔잉, 지금 바로 회사 제출용 건보 자격특실 확인서 2부 주민센터 주민 번호 뒷자리 비공개 때 해주셔잉,0,1,0,1,
전라도_건강보험자격득실확인서_middle_aged_male_alloy_0122.mp3,건강보험자격득실확인서, 오늘 바로 입사지원 서류 건강보험 자격득실 확인서 두부 무인 민원 발급기 주민 번호 뒷자리 비공개 출력해보라인, 오늘 바로 입사지원 서류 건강보험 자격득실 확인서 두부 무인 민원 발급기 주민 번호 뒷자리 비공개 출력해보라인,1,1,1,1,
전라도_건강보험자격득실확인서_senior_female_shimmer_0169.mp3,건강보험자격득실확인서, 방금인 관공소 제출용 자격득실 확인서 내부 무인 민원 발급기 주민번호 뒷자리 비공개 발급 좀 해주시오, 방금인 관공서 제출용 자격득실 확인서 내부 무인 민원 발급기 주민번호 뒷자리 비공개 발급 좀 해주시오,0,1,0,1,
전라도_건강보험자격득실확인서_senior_female_shimmer_0171.mp3,건강보험자격득실확인서, 방금 아이고 자격득실 확인서 두부 주민센터 주민 번호 뒷자리 비공개 출력협으로 인, 방금 아이고 자격득실 확인서 두부 주민센터 주민 번호 뒷자리 비공개 출력협으로 인,0,1,0,1,
전라도_건강보험자격득실확인서_senior_male_echo_0198.mp3,건강보험자격득실확인서," 지금 그러면 학교 제출룬, 건보 자격득실, 확인서 내부, PDF로 현재 주소만 바로 때 해주시오."," 지금 그러면 학교 제출룬, 권보 자격득실 확인서 내부, PDF로 현재 주소만 바로 때 해 주시오.",0,1,0,1,
전라도_건강보험자격득실확인서_youngadult_female_alloy_0131.mp3,건강보험자격득실확인서, 지금 아이고 자격득실 확인서 두부 주소 전체 출력 밝은 패브로인?, 지금 아이고 자격득실 확인서 두부 주소 전체 출력 밝은 패브로인?,0,1,0,1,
전라도_건강보험자격득실확인서_youngadult_female_nova_0146.mp3,건강보험자격득실확인서, 오늘 그라면 회사 제출용 건강보험 자격득실 확인서 무인민원 달급기 현재 주선한 때정해주시오, 오늘 그라면 회사 제출용 건강보험 자격득실 확인서 무인민원 달급기 현재 주선한 때정해주시오,1,1,1,1,
전라도_날씨_child_female_echo_0271.mp3,날씨, 모래 전역 재가문도 어떠단가 인천? 부자잉?, 모래 전역 재감 온도 어떠단가 인천? 부자잉?,0,0,0,0,
전라도_날씨_child_female_onyx_0257.mp3,날씨, 내일 아침 체감 온도 또 단가 광양 부탁해요, 내일 아침 체감 온도 또 단가 광양 부탁해요,0,0,0,0,
전라도_날씨_child_female_shimmer_0270.mp3,날씨, 오늘 저녁 눈 오는가 서울 보자잉, 오늘 저녁 눈 오는가 서울 보자잉,0,0,0,0,
전라도_날씨_child_male_echo_0246.mp3,날씨, 올해 오후 우산 필요하는가 제주 알려주시오, 올해 오후 우산 필요하는가 제주 알려주시오,0,0,0,0,
전라도_날씨_middle_aged_female_echo_0282.mp3,날씨, 오늘 저녁 눈 오는가 목폭? 보사잉, 오늘 저녁 눈 오는가 목표? 보사잉,0,0,0,0,
전라도_날씨_middle_aged_female_onyx_0236.mp3,날씨, 매일 저녁 전주 날씨 어떠단가? 부탁해요., 매일 저녁 전주 날씨 어떠단가? 부탁해요.,1,1,1,1,
전라도_날씨_middle_aged_female_onyx_0239.mp3,날씨, 아침에 청주 기온 좀 알려주시오 알려주시오, 아침에 청주 기온 좀 알려주시오 알려주시오,0,0,0,0,
전라도_날씨_middle_aged_male_onyx_0213.mp3,날씨, 모레오 후 체감 온도 어떠단가 충천 알려주시오, 모레오 후 체감 온도 어떠단가 충천 알려주시오,0,0,0,0,
전라도_날씨_middle_aged_male_onyx_0215.mp3,날씨, 모레오 후 광준화시 어떠단가 확인해볼게요., 모레오 후 광준화시 어떠단가 확인해볼게요.,0,0,0,0,
전라도_날씨_senior_female_alloy_0269.mp3,날씨, 이번 주말 밤 포항 강소 확률 알려주시오 부탁해요, 이번 주말 밤 포항 강소 확률 알려주시오 부탁해요,0,0,0,0,
전라도_날씨_senior_male_alloy_0222.mp3,날씨, 이번 주 금요일 오후 목포 강수 확률 알려주시오, 이번 주 금요일 오후 목포 강수 확률 알려주시오,0,0,0,0,
전라도_날씨_senior_male_onyx_0219.mp3,날씨, 이번 주 금요일 밤 대구 강소 확률 알려주시오. 알려주시오., 이번 주 금요일 밤 대구 강소 확률 알려주시오. 알려주시오.,0,0,0,0,
전라도_날씨_youngadult_female_echo_0286.mp3,날씨, 아침에 광주 기온 좀 알려주시오 알려주시오, 아침에 광주 기온 좀 알려주시오 알려주시오,0,0,0,0,
전라도_날씨_youngadult_male_alloy_0298.mp3,날씨, 모레 오후 눈은과 세죠? 확인해볼게요., 모레 오후 눈은과 세죠? 확인해볼게요.,0,0,0,0,
전라도_날씨_youngadult_male_echo_0231.mp3,날씨, limitationなどなんですけど, what about me other than just talking?,0,0,0,0,
전라도_등본_child_female_echo_0322.mp3,등본, 방금 그러면 학교 제출용 주민등록 등본 세부 모바일 현재 주소만 출혁정 해주시오., 한금 그라면 학교 제출용 주민등록 등본 세부 모바일 현재 주소만 출혁점 해주시오.,1,1,1,1,
전라도_등본_child_male_nova_0324.mp3,등본, 감행하면 빨링! 회사 제출용 주민등록 등론 1부 PDF로 주소 전체출력 바로 뽑아야 주소!, 감행하면 빨링! 회사 제출용 주민등록 등론 1부 PDF로 주소 전체출력 바로 뽑아해 주소!,0,1,0,1,
전라도_등본_middle_aged_male_alloy_0386.mp3,등본, 가능하면 빨리 바로 회사 제출용 등몬 3부 정부 24주민 번호 뒷자리 비공개 바로 때의 주라인, 가능하면 빨리 바로 회사 제출용 등몬 3부 정부 24주민 번호 뒷자리 비공개 바로 때의 주라인,0,0,0,0,
전라도_등본_middle_aged_male_shimmer_0302.mp3,등본, 가는 하면 빨리 학교 제출용 등분 이부 모인 민원 발급기 바로 떼 부러이, 가는 하면 빨리 학교 제출용 등분 이부 모인 민원 발급기 바로 떼 부러이,0,0,0,0,
전라도_등본_middle_aged_male_shimmer_0338.mp3,등본, 당장 아이고 대출 서류용 등번 일부 정부 24주민 번호 뒷자리 비공개 때 좀 해줘라잉, 당장 아이고 대출 서류용 등번 일부 정부 24주민 번호 뒷자리 비공개 때 좀 해줄라잉,0,0,0,0,
전라도_등본_middle_aged_male_shimmer_0363.mp3,등본, 지금 이인 주민등록 등돈이 부 모바일 주민번호 뒷자리 비공개 발급해 줄 아인, 지금 이인 주민등록 등몬 이부 모바일 주민번호 뒷자리 비공개 발급해 줄 아인,0,1,0,1,
전라도_등본_senior_female_alloy_0314.mp3,등본, 오늘 입사 지원 서류 주민 등록 등몬 내부 주민센터 현재 주소만 발급해 주소 하십쯤 지이 등몬 551, 오늘 입사 지원 서류 주민 등록 등봉 내부 주민센터 현재 주소만 발급해 주소 하십쯤 지이 등봉 551,0,1,0,1,
전라도_등본_senior_female_nova_0309.mp3,등본, 앙금 회사 제출용 등몬 두부 PDF로 주소 전체 출혁 바로 떼어주시오. 해식 제이 등몬 397, 앙금 회사 제출용 등몬 두부 PDF로 주소 전체 출혁 바로 떼어주시오. 해시택 제2 등몬 3.9.7,0,0,0,0,
전라도_등본_senior_male_echo_0362.mp3,등본, 가능하면 빨리 그라면 관공서 제출용 주민 등록 등몬 생부 주민센터 바로 발급해주서 제이등본 203, 가능하면 빨리 그라면 관공서 제출용 주민 등록 등몬 생부 주민센터 바로 발급해주서 제이등번 203,1,1,0,1,
전라도_등본_youngadult_female_alloy_0398.mp3,등본, 오늘 익사지원 서류 주민등록 등몬 두부 현재 주소만 달급점 해줄 아인, 오늘 익사지원 서류 주민등록 등본 두 부 현재 주소만 달급점 해줄 아인,0,1,1,1,
전라도_등본_youngadult_female_nova_0315.mp3,등본, 안장바로 학교 대출용 등몬 이브 무인민원 발급기 때 좀 해주시오, 안장바로 학교 대출용 등몬 이브 무인민원 발급기 때 좀 해주시오,0,0,0,0,
전라도_등본_youngadult_male_nova_0379.mp3,등본, 방금 아이고 대출설의 형 등분 일부 모바일 주소 전체 출력 뽑아혀보러 잉, 방금 아이고 대출설의용 등분 일부 모바일 주소 전체 출력 뽑아혀부러 잉,0,0,0,0,
전라도_등본_youngadult_male_shimmer_0348.mp3,등본, 방금 이익 등본 이부 모인 민원 밝읍기 주소 전체 출력 바로 출력해주세요., 방금 이익 등본 이부 모인 민원 밝읍기 주소 전체 출력 바로 출력해주세요.,1,1,1,1,
전라도_초본_child_male_alloy_0462.mp3,초본, 학교 제주룡 주민 등록 초벌 산부 무인 민원 발급기 주민 번호 뒷자리 비공개 발급해 주소 해씨 딱 제2첩원 203, 학교 제주룡 주민 등록 초벌 3부 무인 민원 발급기 주민 번호 뒷자리 비공개 발급해 주소 해씨 딱 제2첩원 203,0,1,0,1,
전라도_초본_child_male_shimmer_0443.mp3,초본, 이익 대출소리형 초본 일부 과거주소포한 발급점 해주소, 이익 대출설형 초본 일부 과거 주소포한 발급점 해주소,1,1,1,1,
전라도_초본_senior_female_nova_0474.mp3,초본, 방금 아이고 학교 제출용 주민등록 초본 내부 정부 24 과거 주소 포함대에 보란께, 방금 아이고 학교 제출용 주민등록 초본 내부 정부 24 과거 주소 포함대에 보란게,1,1,1,1,
전라도_초본_senior_male_echo_0469.mp3,초본, 지금 바로 회사 제출용 처벌내고 5바일 현재 주소만 발급 펴부러잉, 지금 바로 회사 제출용 처벌내 부 5발� 현재 주소만 발급 펴부러잉,0,1,0,1,
전라도_초본_senior_male_nova_0450.mp3,초본, 가능하면 빨리 관곤서 제출용 초본 두부 무인 민원 발급기 떼어보러인, 가능하면 빨리 관곤서 제출용 초본 두부 무인 민원 발급기 떼어부러인,1,1,1,1,
전라도_초본_senior_male_nova_0483.mp3,초본," 아이고, 주민 등맥 초본 일부 PDAF로 발급표 브러잉?"," 아이고, 주민 등맥 초본 일부 PDF로 발급표 브러인?",1,1,1,1,
전라도_초본_senior_male_shimmer_0417.mp3,초본, 지금 아이고 광공사 제출력 처분 일부 모바일 주포 전체출력 바로 뽑아 해볼께, 지금 아이고 광공사 제출력 처분 일부 모바일 주소 전체출력 바로 뽑아해볼께,0,0,0,0,
전라도_초본_youngadult_female_echo_0414.mp3,초본," 지금 가면 대출 서류용, 초본 3부, 모바일 주민번호 뒷자리 비공개 뽑아줘서 H2 초본 551"," 지금 가면 대출 서류용, 초본 3부, 모바일 주민번호 뒷자리 비공개 뽑아줘서 H2 초본 551",1,1,1,1,
전라도_초본_youngadult_female_echo_0463.mp3,초본, 지금 관공사 제출용 주민등록 초본 두부 모바일 현재 주소만 뽑아줘 헤드라잉, 지금 관공사 제출용 주민등록 초본 두부 모바일 현재 주소만 뽑아줘 헤드라잉,1,1,1,1,
전라도_초본_youngadult_female_echo_0486.mp3,초본, 튀은 그러면 광공서 제출용 초본 일부 주민센터 바로 출력해보란게, 튀은 그라맨 광공서 제출용 초본 일부 주민센터 바로 출력해보란게,1,1,1,1,
전라도_초본_youngadult_female_onyx_0407.mp3,초본, 당장인 대출 서류형 주민 등록 초보 일부 정부 24 과거 주소 포함 출력 좀 해주소, 당장인 대출 서류형 주민 등록 초보낄부 정부 24 과거 주소 포함 출력 좀 해주소,0,1,0,1,
전라도_초본_youngadult_female_onyx_0496.mp3,초본," 당장 그라면 관공서 제출용, 초본 모바일 주소 전체 출역, 발급 펴브러잉"," 악장그라면 관공서 제출용, 초본 모바일 주소 전체 출역, 발급 펴브러잉",1,1,1,1,
전라도_초본_youngadult_male_nova_0464.mp3,초본, 오늘 바로 초본 내부 주민센터 출력해주시오. 하체 초본 542., 오늘 바로 초본 내부 2민센터 출력해주시오. 하체 초본 542,1,1,1,1,
전라도_초본_youngadult_male_onyx_0411.mp3,초본," 안금 바로 대출설용, 초본 PDF로 현재 주소만 뽑아줘서 하시택 제이 초본 166백역."," 안금 바로 대출소리용, 초본 PDF로 현재 주소만 뽑아줘서 하시택 제이 초본 166백역.",1,1,1,1,
전라도_행사_child_male_alloy_0682.mp3,행사," 올해 5 후, 춘천 공연 일정 알려주시오. 알려주시오."," 올해 오후,春천공연 일정 알려주시오. 알려주시오.",0,1,0,1,
전라도_행사_middle_aged_female_onyx_0639.mp3,행사, 오후의 가족이랑 갈만한 제주 행사 추천해 줄 아인 부탁해요, 오후의 가족이랑 갈만한 제주 행사 추천해 줄 아인 부탁해요,1,1,1,1,
전라도_행사_middle_aged_female_onyx_0657.mp3,행사, 밤에 대전쪄 캉사정보 보여주소 알려주시오, 밤에 대전쪄 캉사정보 보여주소 알려주시오,0,0,0,0,
전라도_행사_middle_aged_male_alloy_0669.mp3,행사, 이번 주말 아침 전주 풀리마켓 하는가 확인해볼게요, 이번 주말 아침 전주 풀리마켓 하는가 확인해볼게요,0,0,0,0,
전라도_행사_middle_aged_male_nova_0622.mp3,행사, 이번 주말 밤 서울 공연 일정 알려주시오. 확인해볼게요., 이번 주말 밤 서울 공연 일정 알려주시오. 확인해볼게요.,0,1,0,1,
전라도_행사_middle_aged_male_onyx_0613.mp3,행사, 아메 가족이랑 갈만한 창원 행사 추천해 줄 아인 알려주시오, 아메 가족이랑 갈만한 창원 행사 추천해 줄 아인 알려주시오,1,1,1,1,
전라도_행사_middle_aged_male_onyx_0646.mp3,행사, 아침에 울산 이번 주 축제 보여?, 아침에 울산 이번 주 축제 모여,0,0,0,0,
전라도_행사_senior_female_echo_0636.mp3,행사, 이번 주 금요일 밤 전주행사 모이った인가?, 이번 주 금요일 밤 전주행사 모이った인가?,1,0,1,0,
전라도_행사_senior_female_shimmer_0631.mp3,행사, 저녁의 대구 행사 일정 확인해보자인 부자인, 저녁에 대구 행사 일정 확인해보자인 부자인,1,1,1,1,
전라도_행사_senior_male_alloy_0671.mp3,행사, 아침에 대구 쪽 행사 정보 보여주소 부탁해요, 아침에 대구 쪽 행사 정보 보여주소 부탁해요,1,1,1,1,
전라도_행사_youngadult_female_shimmer_0670.mp3,행사, 저녁의 가족이랑 갈만한 세종 행사 추천해 줄 아잉 부탁려요., 저녁의 가족이랑 갈만한 세종 행사 추천해 줄 아잉 부탁려요.,1,1,1,1,
전라도_행사_youngadult_male_nova_0615.mp3,행사, 다음 주말 아침 제주 풀리마켓 하는가?, 다음 주말 아침 제주 풀리마켓 하는가?,0,0,0,0,
전라도_행사_youngadult_male_nova_0698.mp3,행사, 아침에 뭐 포행사 일정 확인해보자인? 확인해볼게요., 아침에 뭐 보행사 일정 확인해보자인? 확인해볼게요,1,1,1,1,
