file,keyword,text_a,text_c,match_a,match_b,match_c,match_d,condition
제주도_등본_youngadult_male_alloy_0345.mp3,등본, 방금 등번 내부 PDF로 현재 주소만 바로 뽑았대 주게, 방금 등번 내부 PDF로 현재 주소만 바로 뽑았대 주게,0,0,0,0,
제주도_등본_youngadult_male_onyx_0300.mp3,등본, 악기호 제출용 등본 내부 모바일 주민번호 뒷자리 비공개 바로 때 해줘서, 악기호 제출용 등본 내부 모바일 주민 번호 뒷자리 비공개 바로 때 해줄 서,1,1,1,1,
제주도_등본_youngadult_male_shimmer_0371.mp3,등본," 방금 관공서 제출용 주민 등록 등몬 두 부, 무인 민원 발급기 주민 번호 뒷자리 피공개 발급주계맛습니다. 하시 대한 등몬 전공명"," 방금 관공서 제출용 주민 등록 등몬 두부, 무인 민원 발급기 주민 번호 뒷자리 비공개 발급주계맛습니다. 하시 대한등본 전공명",0,1,1,1,
제주도_초본_child_female_alloy_0409.mp3,초본, 당장 회사 제출용 초본 내부 주민센터 과거주소포한 발급주계 맛음, 당장 회사 제출용 초본 내부 주민센터 과거주소포한 발급주계 맛음,1,1,1,1,
제주도_초본_child_female_alloy_0485.mp3,초본," 지금 입사지원서를 초본 내부, 정부 24 과거 주소 포함 뽑아주게 맞슴."," 지금 입사지원서를 초본 내부, 정부 24 과거 조소 포함 뽑아주게 맞슴.",1,1,1,1,
제주도_초본_child_female_echo_0438.mp3,초본, 방금 회사 재출용 주민등록 초보 일부 모바일 과거 주소 포한 필요하우다 뽑아 발급해 줬어 481 3 2 4 2 3, 방금 회사 재출용 주민등록 처벌 일부 오바에 과거 주소 포한 필요하우다 뽑아 발급해 줬어 48나 3이 4 2 3,0,1,0,1,
제주도_초본_child_male_echo_0448.mp3,초본, 당장 학교제 출연 주민 등록 처벌 내부 PDF로 현재 주소만 뽑았대주개, 당장 학교제 주령 주민등록 처벌 내부 PDF로 현재 주소만 뽑았대주개,0,1,0,1,
제주도_초본_middle_aged_female_nova_0457.mp3,초본, 가능하면 빨리 회사 제출용 초본 정부 24주소 전체 출혁 발급 주개맛은, 가능하면 빨리 회사 제출용 초본 정부 24주소 전체 출혁 발급주계맛은,1,1,1,1,
제주도_초본_middle_aged_female_shimmer_0418.mp3,초본," 오늘 대출 서류용 초본 한부, 무인 민원 발극기, 주민번호 뒷자리 비공개 뽑아 발급해 주십쌍"," 오늘 대출 서류용 초본 한부, 무인 민원 발극기, 주민번호 뒷자리 비공개 뽑아 발급해 주십사",1,1,1,1,
제주도_초본_middle_aged_male_echo_0491.mp3,초본, 앙장 회사 대출용 주민등록 처벌 일부 무인 민원 발급기 과거 주소 포함 필요가 오다., 앙장 회사 제출용 주민등록 처벌 일부 무인 민원 발급기 과거 주소 포함 필요가 없다.,0,1,0,1,
제주도_초본_middle_aged_male_nova_0400.mp3,초본, 악장 초본 두부 주민센터 발급주개 마신, 악장 초본 두부 주민센터 발급주개 맛은,1,1,1,1,
제주도_초본_middle_aged_male_onyx_0460.mp3,초본, 앙금 대출 서류형 주민등록 처벌 세부 정부 24 과거 주소 포함 발급주계 맞습니다., 앙금 대출 서류형 주민등록 처벌 세부 정부 24 과거 주소 포함 발급주계 맞습니다.,0,1,0,1,
제주도_초본_senior_female_alloy_0472.mp3,초본, 지금 대출 서류용 초본 한 부 주민센터 현재 조소만 필요하오다. 뽑아해주게 마심. 해시택은 초본 463., 지금 대출 서류용 초본 한 부 주민센터 현재 조소만 필요하오다 뽑아해주게 마심 해시택은 초본 463,1,1,1,1,
제주도_초본_senior_female_echo_0437.mp3,초본, 오늘 회사 대출용 초본 인이부 모바일 과거 주소 포함 때주게 맞음, 오늘 회사 대출용 초본 인이브 모바일 과거 주소 포함 때주게 맞음,1,1,1,1,
제주도_초본_senior_female_nova_0423.mp3,초본," 지금 주민등록 초본 3부, 정부 24 필요하우다 뽑아 해 주게."," 지금 주민등록 초본 3부, 정부 24 필요하우다 뽑아 해 주게.",1,1,1,1,
제주도_초본_senior_female_shimmer_0471.mp3,초본, 단장 대출서를 이용 주민등록 초본 3부 과거 주소 포함 바로 발급밝에 해줘서, 단장 대출서를 이용 주민 등록초본 3부 과거 주소 포함 바로 발급밝에 해줘서,1,1,1,1,
제주도_초본_youngadult_female_echo_0412.mp3,초본, 방금 주민 등록 처벌 일부 무인 민원 달급기 현재 주소만 달급 빨급해지게 맞음, 방금 주민 등록 초본 일부 무인 민원 달급기 현재 주소만 달급 빨급해지게 맞습니다.,0,1,1,1,
제주도_초본_youngadult_female_nova_0498.mp3,초본, 가능하면 빨리 회사 제출용 초본 이부 PDF로 주민번호 뒷자리 비공개 바로 발급되지게, 가능하면 빨리 회사 제출용 초본 이부 PDF로 주민번호 뒷자리 비공개 바로 발급되지게,1,1,1,1,
제주도_초본_youngadult_female_onyx_0431.mp3,초본, 가능하면 빨리 회사 대출력 초본 3부 정부 24 과거 주소 보아때 해줄 서 H1 초본 1치를, 가능하면 빨리 회사 대출력 초본 3부 정부 24 과거 주소 보아때 해줄 수 8211,1,1,1,1,
제주도_초본_youngadult_male_alloy_0424.mp3,초본, 방금 배출설유용 주민등록 초본 세부 PDF로 주소 전체 출력 발급주개 맞음, 방금 배출설유용 주민등록 초본 세부 PDF로 주소 전체 출력 발급주개 맞음,1,1,1,1,
제주도_초본_youngadult_male_onyx_0430.mp3,초본, 안장 초본 내부 무인민원 발급기 주소 전체 출력 뽑아 발급해 줩서, 안장 초본 내부 무인민원 발급기 주소 전체 출력 뽑아 발급해 줩서,1,1,1,1,
제주도_초본_youngadult_male_shimmer_0489.mp3,초본," 가능하면 빨리 입사지원 서류, 주민 등록 초본, 모바일 현재 주소만 발급지게 맞슴."," 가능하면 빨리 입사지원 서류, 주민 등록 초본, 모바일 현재 주소만 발급지게 맞슴.",1,1,1,1,
제주도_행사_child_female_onyx_0621.mp3,행사, 아메 대구 이번 주 측제 모과, 아메 대구 이번 주 측제 모과,0,0,0,0,
제주도_행사_child_female_onyx_0643.mp3,행사, 오후에 목포 이번 주 축제 모호과 부터커드 행사 2구구, 오후에 목포 이번 주 축제 모호과 부터커드 하행사 2구구,1,1,1,1,
제주도_행사_child_female_shimmer_0694.mp3,행사, 밤에 가족이랑 갈만한 대전 행사 추천해 줍서 알려주게 맞음., 밤에 가족이랑 갈만한 대전 행사 추천해 줍서 알려주게 맞음.,1,1,1,1,
제주도_행사_child_male_alloy_0637.mp3,행사, 오후의 대구 행사 일정 보여줄게, 오후의 대구 행사 일정 보여줄게,1,1,1,1,
제주도_행사_child_male_onyx_0655.mp3,행사, 아침에 가족이랑 갈만한 청주 행사 추천해 주소 보주게, 아침에 가족이랑 갈만한 청주 행사 추천해 주셔서 보주게,1,1,1,1,
제주도_행사_child_male_shimmer_0601.mp3,행사, 밤에 오늘 춘천 공연 일정 알러주게 마심 확인해 줍서 하시제 행사 644, 밤에 오늘 춘천 공연 일정 알러주게 마심 확인해 줍서 하시제 행사 644,1,1,1,1,
제주도_행사_middle_aged_female_alloy_0666.mp3,행사, 오후의 가족이랑 갈만한 부산 행사 추천해 줍소와 부탁가오다, 오후의 가족이랑 갈만한 부산 행사 추천해 줍소와 부탁가오다,1,1,1,1,
제주도_행사_middle_aged_male_nova_0617.mp3,행사, 오후의 제주 행사 일정 보여주게 부탁하우다. 다시 지이제 행사 151., 오후의 제주 행사 일정 보여주게 부탁하우다. 다시 진의제 행사 151.,1,1,1,1,
제주도_행사_senior_female_nova_0602.mp3,행사, 아침에 순천 근처 행사 정보 알려주게 마심 확인해 줍서, 아침에 순촌 근처 행사 정보 알러주게 마심 확인해 주십소,1,1,1,1,
제주도_행사_senior_female_nova_0625.mp3,행사, 밤에 오늘 전주 필리 마켓 타옥과 하시점 G2 행사 오륙구, 밤에 오늘 전주 필리 마켓 타우과 하시점 2행사 오륙구,1,1,1,1,
제주도_행사_senior_female_nova_0652.mp3,행사, 오후의 워낙 제주 플리 마켓 하우과 보주게, 오후의 원할 제주 플리 마켓 하우과 보주게,0,0,0,0,
제주도_행사_senior_female_onyx_0650.mp3,행사, 전역에 무료 행사 있을과 수원, 전역에 무료 행사 있을과 수원,1,1,1,1,
제주도_행사_senior_female_shimmer_0695.mp3,행사, 오후의 세종 이번넛주 축제 모옥과 도주계, 오후 3종 2번을 주축제 모우과 도주계,0,0,0,0,
제주도_행사_senior_male_alloy_0616.mp3,행사, 오후에 오늘 제주 공연 일정 알러주게 맞슴 부탁하오다., 오후의 오늘 제주 공연 일정 알러주게 맞슴 부탁하다,0,1,0,1,
제주도_행사_senior_male_alloy_0672.mp3,행사, 아침에 온아의 세종 행사 모이스과 부탁 커다, 아침에 온아의 세종 행사 모이스과 부탁 커다,1,1,1,1,
제주도_행사_senior_male_echo_0677.mp3,행사, 저녁에 창원 이번 주 측제 모으과 알러주게 마심 저 행사 7사사, 저녁에 창은 이번 주 집제 모과 알러주게 마심 저 행사 7사사,1,1,1,1,
제주도_행사_senior_male_echo_0692.mp3,행사, 아침에 무료 행사에 있을과 광양 알러주게 맞음, 아침에 무료 행사에 있을과 광양 알러주게 맞음,1,0,1,0,
제주도_행사_senior_male_nova_0626.mp3,행사, 저녁의 청주 근처 행사정보 알러 2개 마심, 전역의 청주 근처 행사정보 알러주게 마심,1,0,1,0,
제주도_행사_senior_male_onyx_0680.mp3,행사," 오후의 가족이랑 갈만한 태구 행사, 추천해 줩소. 제이의 행사 시트구.", 오후의 가족이랑 갈만한 태구 행사 추천해 줩소 제이의 행사 시트구,1,1,1,1,
제주도_행사_senior_male_shimmer_0647.mp3,행사, 아메 부산 근처 행사정보 알러주기 마심 확인해 집소., 아메 부산 근처 행사정보 알러주기 마심 확인해 집소,1,0,1,0,
제주도_행사_youngadult_female_echo_0678.mp3,행사, 저녁에 오늘 청주 플리마켓 하우과 알러주게 맞슴, 저녁에 오늘 청주 플리마켓 타옥과 알러주게 맞슴,0,0,0,0,
제주도_행사_youngadult_female_nova_0664.mp3,행사, 저녁에 무료 행사의 숙과 칭찬 알러주게 마십., 저녁에 무료 행사의 숙과 칭찬 알러주게 마십,1,0,1,0,
제주도_행사_youngadult_female_nova_0673.mp3,행사, 아침에 온할 대전 행사 모이 숙과 보주게, 아침에 오늘 대전 행사 모이 습과 보주게,1,1,1,1,
제주도_행사_youngadult_female_onyx_0634.mp3,행사, 밤의 가족이랑 가리마단 창원 행사 추천해 줩서 알로주게 마심 강감아 강감아 H 행사 공유공공, 밤의 가족이랑 가리만한 창원 행사 추천해 줩서 알로주게 마심 강감아 강감아 H 행사 공유공공,1,1,1,1,
제주도_행사_youngadult_male_nova_0604.mp3,행사, 아침에 오늘 춘천 행사 모의 숙과 알러주게 났음, 아침에 오늘 춘천 행사 모이 숙과 알러주게나취미,1,1,1,1,
지역_카테고리_child_male_onyx_0700.mp3,카테고리, 멘트, 멘트,0,0,0,0,
충청도_가족관계증명서_child_female_echo_0011.mp3,가족관계증명서, 가족 관계 직명서 바이급 신청하렙니다., 가족 관계 증명서 바이급 신청하렙니다.,0,1,1,1,
충청도_가족관계증명서_child_female_echo_0087.mp3,가족관계증명서, 가속관계 직명서 발급 신청합니다., 가속관계 직명서 발급 신청합니다.,0,0,0,0,
충청도_가족관계증명서_child_female_nova_0044.mp3,가족관계증명서, 내 가접관계 증명서 좀 봐도요?, 내 가속 관계 증명서 좀 봐도요?,0,1,0,1,
충청도_가족관계증명서_child_male_echo_0085.mp3,가족관계증명서, 아버지 이름으로 가족관계 직명서 한통 발급 좀 해줘요, 아버지 이름으로 가족관계 직명서 한통 발급 좀 해줘요,0,1,0,1,
충청도_가족관계증명서_child_male_shimmer_0053.mp3,가족관계증명서, 요새는 가족 관계 증명서도 인터넷으로 다 되죠, 요새는 가족 관계 증명서도 인터넷으로 다 되세요.,1,1,1,1,
충청도_가족관계증명서_middle_aged_female_nova_0093.mp3,가족관계증명서," 그리고 가족투명서 한 부 킬리완의 요. 그래서 지금 요, 발급 좀 해줘요. 해주실래요?", 그리고 가족 증명서 한 부 필요하네요. 그래서 지금 발급 좀 해줘요. 해주실래요?,0,0,0,1,
충청도_가족관계증명서_middle_aged_male_onyx_0033.mp3,가족관계증명서, 가족 관계 측명서 한통 발급 좀 해줘요. 유주시면 안 되겠어요?, 가족 관계 측명서 한통 발급 좀 해줘요. 유주시면 안 되겠어요?,0,1,0,1,
충청도_가족관계증명서_middle_aged_male_onyx_0081.mp3,가족관계증명서, 인터넷으로 가족 관계 증명서 떨라고 그런다 요, 인터넷으로 가족 관계 증명서 떨라고 그런다 요,1,1,1,1,
충청도_가족관계증명서_senior_female_nova_0051.mp3,가족관계증명서, 기금여 가족 관계 측량서 두 후보 발급점 해줘유주게 마시며, 기금역 가족 관계 측량서 2부 발급점 해줘유주게 마시며,0,1,0,1,
충청도_가족관계증명서_youngadult_female_alloy_0030.mp3,가족관계증명서, 내 가족 관계 증명서 좀 봐보자요, 내 가족 관계 증명서 좀 바보자요,1,1,1,1,
충청도_가족관계증명서_youngadult_female_alloy_0058.mp3,가족관계증명서," 가족 관계 지면서 발급점에서 유서, 스캔에서 보내주인유", 가족권기 지면서 발급점 해줘요서 스캔에서 보내주인유,0,1,0,1,
충청도_가족관계증명서_youngadult_male_echo_0054.mp3,가족관계증명서, 가족 관계 증명서 있어야 희닙 신고 한다냐요?, 가족 관계 증명서 있어야 흰인 신고 한다냐요?,1,1,1,1,
충청도_가족관계증명서_youngadult_male_onyx_0042.mp3,가족관계증명서, 가족 관계 직몸서 발급 되나요?, 가족 관계 직몸서 발급 되나요?,0,1,0,1,
충청도_건강보험자격득실확인서_child_female_onyx_0151.mp3,건강보험자격득실확인서, 내역 단아옥의 자격득실 확인서 발급 좀 해줘요., 내역 단아옥의 자격득실 확인서 발급 좀 해줘요.,0,1,0,1,
충청도_건강보험자격득실확인서_child_female_onyx_0187.mp3,건강보험자격득실확인서," 지금요, 건보 자격득실 확인서 발급 좀 해줘요, 이게 맞습니다."," 지금요, 건보 자격득실 확인서 발급 좀 해줘요, 이게 맞습니다.",0,1,0,1,
충청도_건강보험자격득실확인서_child_female_shimmer_0181.mp3,건강보험자격득실확인서, 자격득시우 확인서 한 번만 주셔요., 자격대X유 확인서 한 번만 주셔요.,0,1,0,1,
충청도_건강보험자격득실확인서_child_male_onyx_0130.mp3,건강보험자격득실확인서, 프린트 되야 자격득시로 확인서 뽑게요, 프린트 되야 자격득시로 확인서 뽑게요,0,1,0,1,
충청도_건강보험자격득실확인서_middle_aged_female_nova_0193.mp3,건강보험자격득실확인서, 제격 특수 확인서 한 통만 발급 좀 해줘요, 제격 특수 확인서 한 통만 발급 좀 해줘요,0,1,0,1,
충청도_건강보험자격득실확인서_middle_aged_female_onyx_0144.mp3,건강보험자격득실확인서, 자격 특힣 확인서 출력 좀 해줘요, 자격트 7 확인서 출력 좀 해줘요,0,1,0,1,
충청도_건강보험자격득실확인서_middle_aged_female_onyx_0158.mp3,건강보험자격득실확인서," 그려, 지금 야 건보 자격득시로 확인해서 발급 좀 해줘요, 주게 마십ню"," 그리어, 지금 야 건보 자격득시로 확인해서 발급 좀 해줘요, 주게 마십ню",0,1,0,1,
충청도_건강보험자격득실확인서_senior_female_echo_0133.mp3,건강보험자격득실확인서, 건강보험 공단 가서 자격특실 확인서 발급정 해적 요구 와야요, 건강보험 공단 가서 자격특실 확인서 발급정 해줘요고 와야요,0,1,0,1,
충청도_건강보험자격득실확인서_senior_male_alloy_0154.mp3,건강보험자격득실확인서, 언보 잔적 특실 확인서 일부 발급 좀 해줘요 해주실래요?, 언보 장적특실 확인서 일부 발급 좀 해줘요 해주실래요?,0,1,0,1,
충청도_건강보험자격득실확인서_senior_male_nova_0185.mp3,건강보험자격득실확인서, 자격 특수 확인서의 네 역 다 나오게요, 자격특시우 확인서의 네 역 다 나오게요,0,1,0,1,
충청도_건강보험자격득실확인서_youngadult_female_echo_0111.mp3,건강보험자격득실확인서, 엉간보험공단 가서 자격특실 확인서 발급 좀 해줘요., 엉간보험공단 가서 자격특실 확인서 발급 좀 해줘요.,0,1,0,1,
충청도_건강보험자격득실확인서_youngadult_female_echo_0142.mp3,건강보험자격득실확인서, 자격득시 확인서 뽑을 줄 아나요?, 자격득 씨의 확인서 뽑을 줄 아나요?,0,1,0,1,
충청도_건강보험자격득실확인서_youngadult_male_echo_0153.mp3,건강보험자격득실확인서, 그리고 자격득시로 확인서의 예전 회사 다 나오게 해줘서요, 그리고 자격득시로 확인서의 예전 회사 다 나오게 해줘서요,0,1,0,1,
충청도_날씨_child_female_alloy_0251.mp3,날씨, 내일 날씨 맑음이라던데요?, 내일 날씨 맑음이라던데요?,1,1,1,1,
충청도_날씨_child_female_echo_0281.mp3,날씨, 날씨 좋으면 놀러가자요., 날씨 좋으면 놀러가자요.,1,1,1,1,
충청도_날씨_child_female_echo_0293.mp3,날씨, 보왕 바람 하영 북주거에요, 보왕 바람 하영 북주거에요,0,0,0,0,
충청도_날씨_child_female_onyx_0211.mp3,날씨, 날씨 보고 잘 챙겨 입어라 이뇨, 날씨 보고 잘 챙겨 입어라 이뇨,1,1,1,1,
충청도_날씨_child_male_shimmer_0254.mp3,날씨, 그려 오늘 날씨 위에 대노유, 그리어 오늘 날씨 위에 대노유,1,1,1,1,
충청도_날씨_middle_aged_female_echo_0253.mp3,날씨, 강소 확률 몇% 다녀요?, 강소 확률 몇% 다녀요?,0,0,0,0,
충청도_날씨_middle_aged_female_shimmer_0285.mp3,날씨, 내일 날씨 보고 빨래야 쓰고 있다요., 내일 날씨 보고 빨래야 쓰고 있다요.,1,1,1,1,
충청도_날씨_middle_aged_male_alloy_0244.mp3,날씨, 날 시업 풀 한번 켜바라요, 날 시업을 한 번 켜바라요,0,0,0,0,
충청도_날씨_senior_male_alloy_0233.mp3,날씨, 오늘 날씨 진짜 변덕스럽네요., 오늘 날씨 진짜 변덕스럽네요.,1,1,1,1,
충청도_날씨_youngadult_female_alloy_0287.mp3,날씨, 그려 내일 날씨 말금이라더만요, 그려 내일 날씨 말금이라더만요,1,1,1,1,
충청도_날씨_youngadult_female_echo_0242.mp3,날씨,クレオ、大使い入り込むよ, 그럼 날씨와 이리똄의 요,0,0,1,0,
충청도_날씨_youngadult_female_onyx_0230.mp3,날씨, 오늘 날씨 후에 되노여, 오늘 날씨 후에 되노여,1,1,1,1,
충청도_날씨_youngadult_female_onyx_0258.mp3,날씨, 날씨 업을 뭐가 정확하노요?, 날씨 업을 뭐가 정확하노요?,1,1,1,1,
충청도_등본_child_female_alloy_0335.mp3,등본, 등곰 발급 좀 해줘요서 사진 찍어 보내 도요, 등곰 발급점 해줘요서 사진 찍어 보내 도요,0,1,0,1,
충청도_등본_child_female_nova_0370.mp3,등본, 인봉 그거 오늘 안에 바이급 좀 해줘야 쓴 뇌, 인봉 그거 오늘 안에 발급 좀 해줘야 쓴 뇌,0,0,0,1,
충청도_등본_child_male_echo_0392.mp3,등본, 등본 때를 줄 알아요?, 등본 때를 줄 알아요?,1,1,1,1,
충청도_등본_child_male_onyx_0349.mp3,등본, 행본 한통 발급받으러 왔는데요., 등분한 통 발급받으러 왔는데요.,0,0,0,0,
충청도_등본_middle_aged_female_echo_0319.mp3,등본, 은행 제출룡으로 등분한통 발급점 해줘요 주소유, 은행 제출룡으로 등분한통 발급점 해줘요 주소유,0,0,0,0,
충청도_등본_middle_aged_female_nova_0339.mp3,등본, 그래? 주민센터 문 닫기 전에 등분 발급 좀 해줘요., 그래요? 주민센터 문 닫기 전에 등분 발급 좀 해줘요.,0,1,0,1,
충청도_등본_middle_aged_female_shimmer_0373.mp3,등본, 오늘 주물로 등방소료 가져올나요, 오늘 정무로 등방소료 가져올나요,0,0,0,0,
충청도_등본_middle_aged_male_alloy_0355.mp3,등본, 등봉 발급 좀 해줄게 가야 되는데 귀찮네요., 등봉 발급 좀 해줄게 가야 되는데 귀찮네요.,0,1,0,1,
충청도_등본_middle_aged_male_nova_0332.mp3,등본, 드린 등록등 본 두부 바로 발급 좀 해줘요. 해주래요?, 드린 등록등 본투부 바로 발급 좀 해줘요. 해주래요?,1,1,1,1,
충청도_등본_middle_aged_male_shimmer_0321.mp3,등본, 동사무소 가서 등 봄부터 발급 좀 해줘야 하겠다요., 동사무소 가서 등 봄부터 발급 좀 해줘야 하겠다요.,0,1,0,1,
충청도_등본_senior_female_alloy_0313.mp3,등본, 동세와 무속 가서 등분한 통 발급 좀 해줘요. 와야요., 동세험 속아서 등분한 통 발급 좀 해줘요. 와야요.,0,1,0,1,
충청도_등본_senior_male_alloy_0346.mp3,등본, 그려 내 것 등분 좀 발급 좀 해줘요 줄 수 있겠나요?, 그려 내 것 등분 좀 발급 좀 해줘요 질 수 있겠나요?,0,1,0,1,
충청도_등본_senior_male_onyx_0384.mp3,등본, 그려 등몸 발급 좀 해줘 요서 사진 찍어 보내 노유, 그려 등몸 발급 좀 해줘요서 사진 찍어 보내 노유,0,1,0,1,
충청도_등본_youngadult_female_shimmer_0381.mp3,등본, 그려 은행 내아낸 뒤 등분 한 장 맞려, 그려 은행 내아낸 뒤 등분 한 장 맞려,0,0,0,0,
충청도_초본_child_female_echo_0439.mp3,초본, 초보는 왜 필요하다고 하는데요?," 초보는 왜 필요하다, 간어요?",0,0,0,0,
충청도_초본_child_female_onyx_0432.mp3,초본," 그려, 2분 그거 한 통 발급 좀 해줘요. 이러 왔어요?"," 그려, 2분 그거 한 통 발급 좀 해줘요. 이러 왔어요?",0,1,0,1,
충청도_초본_child_female_shimmer_0413.mp3,초본," 4부, 주민등록 초본, 밝급 좀 해줘요. 요회해주실래요?", 4부 주민등록 초본 발급점 해줘요. 요회해주실래요?,1,1,1,1,
충청도_초본_child_female_shimmer_0435.mp3,초본, 초보는 못담씨 필요하다냐요., 초보는 못담씨 필요하다냐요.,0,0,0,0,
충청도_초본_child_male_alloy_0421.mp3,초본, 초범 발급점 해져 있는 것은 참인이에요., 초범 발급 좀 해줘야 하는 것은 참인이에요.,0,0,0,1,
충청도_초본_child_male_alloy_0455.mp3,초본, 선애들은 초본 떨릴이 많아요., 선애들은 초본 떨릴이 많아요.,1,1,1,1,
충청도_초본_middle_aged_female_alloy_0419.mp3,초본, 초본 어딘지서 발급점 해줘 있는지 안하여, 초본 어딘지서 발급점 해줘 있는지 안아요?,1,1,1,1,
충청도_초본_middle_aged_female_alloy_0446.mp3,초본, 행본 말고 초본으로 발급점 해줘요., 잉몸 말고 초본으로 발급점 해줘요,1,0,1,0,
충청도_초본_middle_aged_female_onyx_0473.mp3,초본, 초본이랑 등본이랑 다른 것이예요, 초본이랑 등본이랑 다른 것이예요,1,0,1,0,
충청도_초본_middle_aged_male_alloy_0470.mp3,초본, 초보는 못담씨 필요하다냐요., 초보는 못담씨 필요하다냐라요.,0,0,0,0,
충청도_초본_middle_aged_male_alloy_0484.mp3,초본," 지금 야, 초본 5부 바로 발급점 해줘요."," 지금 야, 초본 5부 바로 발급점 해줘요.",1,1,1,1,
충청도_초본_senior_male_alloy_0492.mp3,초본, 초본 발급점 해줘유서 팩스로 좀 보내주세요, 초본 발급점 해줘유사 팩스로 좀 보내주세요,1,1,1,1,
충청도_초본_youngadult_male_echo_0481.mp3,초본, 주민 등록 처벌 일부 바로밝급 좀 해줘요. 해주셔요., 주민 등록초본 일부 바로밝급 좀 해줘요. 해주셔요.,0,1,1,1,
충청도_초본_youngadult_male_shimmer_0449.mp3,초본, 주민 등록 토본 발급점 해줘요 주실 분이, 주민 등록 초본 발급점 해줘요 주실 분이,0,1,1,1,
충청도_축제_child_female_alloy_0520.mp3,축제, 죽제의 사람 비기 많겠지요., 죽제의 사람 비기 많겠죠?,0,0,0,0,
충청도_축제_child_female_alloy_0593.mp3,축제, 무슨 축제가 제일 유명한 오요?, 무슨 축제가 제일 유명한 오요?,1,0,1,0,
충청도_축제_child_female_echo_0500.mp3,축제, 그려 가을에는 뭔 축제가 있다냐요?, 그려 가을에는 뭔 축제가 있다냐요,1,0,1,0,
충청도_축제_child_female_echo_0551.mp3,축제, 축제 갈 때 모입고 갈까요?, 축제 갈 때 모입고 갈까요?,1,1,1,1,
충청도_축제_child_female_echo_0598.mp3,축제, 대학 축제 구경가장께요., 대학 축제의 구경가장께요.,1,1,1,1,
충청도_축제_child_female_nova_0567.mp3,축제, 가을에는 뭔 축제가 있다냐 요?, 가을에는 뭔 축제가 있다냐요?,1,0,1,0,
충청도_축제_child_female_onyx_0581.mp3,축제, 축제하는데 주차할 때 있나요?, 축제하는데 주차할 때 있나요?,1,0,1,0,
충청도_축제_child_female_onyx_0582.mp3,축제, 이번 축제는 뭐 좀 다른 거 하나요?, 이번 축제는 뭐 좀 다른 거 하나요?,1,0,1,0,
충청도_축제_child_male_alloy_0514.mp3,축제, 쭉쟤 보러 안 갈랑 가요, 쭉쟤 보러 안 갈랑 가요,0,0,0,0,
충청도_축제_child_male_nova_0512.mp3,축제," 그려, 축제 가서 뭐 먹을까요?"," 그려, 축제 가서 뭐 먹을까요?",1,1,1,1,
충청도_축제_child_male_shimmer_0574.mp3,축제," 그려, 축제 마지막 날이라 사람 많다요."," 그려, 축제 마지막 날이라 사람 많다요.",1,1,1,1,
충청도_축제_middle_aged_female_alloy_0528.mp3,축제, 야시장 열리는 춥대 가요, 야시장 열리는 축제 가요,0,0,1,1,
